{
  "schema": "protected-relation-external-adapter-response.v0",
  "challenge_id": "prf-001",
  "challenge_digest": "5092d1e58a43894cf4c4b33a37eb0e13b9f5adf6313205fd660e1738d44ba9a0",
  "protected_relation_profile_digest": "0d26b428a55e7916775daaaf2b3445f2bf2d1dc34f9c8712fd7f08e3d4d91255",
  "evaluator": {
    "id": "local-ollama/qwen2.5:3b-instruct",
    "version": "ollama-0.15.2/model-357c53fb659c",
    "config_digest": "1ac6de6fe2bca2ba85ec638f622b8a58d1c14592147fa3847050a7025721a739"
  },
  "outcome": "VIOLATED",
  "reason_code": "RELATION_MISMATCH",
  "reason_detail": null,
  "evidence": [
    {
      "kind": "UNVERIFIABLE_RELATED_STATEMENT",
      "value": "before contains a member (G) that is not contained in after"
    },
    {
      "kind": "UNVERIFIABLE_RELATED_STATEMENT",
      "value": "after contains a member (H) that is not contained in before"
    }
  ]
}
